{
  "canton_id": 3,
  "canton_name_de": "Luzern",
  "canton_name_fr": "Lucerne",
  "data_timestamp": "2026-07-02T00:00:00",
  "source": "api",
  "regions": [
    {
      "region_id": 37,
      "region_name_de": "Oberaargau",
      "data_timestamp": "2026-07-02T00:00:00",
      "source": "api",
      "cdi": 5,
      "spi_3m": -3.19,
      "soil_moisture_pct": 9.5,
      "vhi": 6.0,
      "cdi_trend": 0,
      "spi_3m_delta": -0.5699999999999998,
      "vhi_delta": 0.0,
      "pct_critical": 0.057692307692307696,
      "spi_3m_percentile": 0,
      "quality": {
        "data_age_days": 1,
        "coverage_pct": 1.0,
        "missing_columns": [],
        "outlier_flags": [],
        "is_stale": false,
        "overall": "ok"
      },
      "precip_sum_1m": 40.0,
      "precip_sum_3m": 124.3,
      "precip_1m_index": 4,
      "soil_moisture_index": 5,
      "hydro_index": 5,
      "warnlevel": 4,
      "warnlevel_info_de": "Grosse Gefahr",
      "warnlevel_info_fr": "Danger fort",
      "cdi_forecast_week2": 5,
      "precip_1m_index_forecast": 3,
      "soil_moisture_index_forecast": 5,
      "precip_deficit_delta": -1,
      "soil_moisture_deficit_delta": 0,
      "vhi_index": 5,
      "discharge": {
        "n_total": 2,
        "n_low": 1,
        "n_very_low": 0,
        "pct_low": 50
      },
      "hydro_stations": [
        {
          "station_id": "2450",
          "station_name": "Zofingen (2450)",
          "current_value": 2.060666666666666,
          "threshold1": 2.634,
          "min_value": 1.385
        },
        {
          "station_id": "2471",
          "station_name": "Murgenthal, Walliswil (2471)",
          "current_value": 1.853,
          "threshold1": 1.775,
          "min_value": 1.166
        }
      ]
    },
    {
      "region_id": 39,
      "region_name_de": "Freiamt",
      "data_timestamp": "2026-07-02T00:00:00",
      "source": "api",
      "cdi": 5,
      "spi_3m": -3.03,
      "soil_moisture_pct": 19.6,
      "vhi": 10.0,
      "cdi_trend": 0,
      "spi_3m_delta": -0.7399999999999998,
      "vhi_delta": 0.0,
      "pct_critical": 0.057692307692307696,
      "spi_3m_percentile": 0,
      "quality": {
        "data_age_days": 1,
        "coverage_pct": 1.0,
        "missing_columns": [],
        "outlier_flags": [],
        "is_stale": false,
        "overall": "ok"
      },
      "precip_sum_1m": 64.0,
      "precip_sum_3m": 144.0,
      "precip_1m_index": 4,
      "soil_moisture_index": 5,
      "hydro_index": 5,
      "warnlevel": 4,
      "warnlevel_info_de": "Grosse Gefahr",
      "warnlevel_info_fr": "Danger fort",
      "cdi_forecast_week2": 4,
      "precip_1m_index_forecast": 1,
      "soil_moisture_index_forecast": 5,
      "precip_deficit_delta": -3,
      "soil_moisture_deficit_delta": 0,
      "vhi_index": 4,
      "discharge": {
        "n_total": 3,
        "n_low": 2,
        "n_very_low": 1,
        "pct_low": 67
      },
      "hydro_stations": [
        {
          "station_id": "2416",
          "station_name": "Hitzkirch, Richensee (2416)",
          "current_value": 0.285,
          "threshold1": 0.621,
          "min_value": 0.24
        },
        {
          "station_id": "2417",
          "station_name": "Oberkirch (2417)",
          "current_value": 0.4043333333333334,
          "threshold1": 0.821,
          "min_value": 0.385
        },
        {
          "station_id": "ZH572",
          "station_name": "Dietikon (ZH572)",
          "current_value": 0.8336666666666667,
          "threshold1": 0.436,
          "min_value": 0.141
        }
      ]
    },
    {
      "region_id": 40,
      "region_name_de": "westliche Zentralschweiz",
      "data_timestamp": "2026-07-02T00:00:00",
      "source": "api",
      "cdi": 5,
      "spi_3m": -2.73,
      "soil_moisture_pct": 38.2,
      "vhi": 34.0,
      "cdi_trend": 0,
      "spi_3m_delta": -0.8699999999999999,
      "vhi_delta": 0.0,
      "pct_critical": 0.09615384615384616,
      "spi_3m_percentile": 0,
      "quality": {
        "data_age_days": 1,
        "coverage_pct": 1.0,
        "missing_columns": [],
        "outlier_flags": [],
        "is_stale": false,
        "overall": "ok"
      },
      "precip_sum_1m": 118.0,
      "precip_sum_3m": 247.1,
      "precip_1m_index": 2,
      "soil_moisture_index": 5,
      "hydro_index": 5,
      "warnlevel": 4,
      "warnlevel_info_de": "Grosse Gefahr",
      "warnlevel_info_fr": "Danger fort",
      "cdi_forecast_week2": 4,
      "precip_1m_index_forecast": 1,
      "soil_moisture_index_forecast": 4,
      "precip_deficit_delta": -1,
      "soil_moisture_deficit_delta": -1,
      "vhi_index": 2,
      "discharge": {
        "n_total": 4,
        "n_low": 1,
        "n_very_low": 0,
        "pct_low": 25
      },
      "hydro_stations": [
        {
          "station_id": "2102",
          "station_name": "Sarnen (2102)",
          "current_value": 5.258666666666667,
          "threshold1": 7.857,
          "min_value": 3.584
        },
        {
          "station_id": "2436",
          "station_name": "Alpnach, Chilch Erli (2436)",
          "current_value": 5.621,
          "threshold1": 0.205,
          "min_value": 0.034
        },
        {
          "station_id": "2481",
          "station_name": "Buochs, Flugplatz (2481)",
          "current_value": 24.137666666666664,
          "threshold1": 20.524,
          "min_value": 11.099
        },
        {
          "station_id": "2634",
          "station_name": "Emmen (2634)",
          "current_value": 28.167,
          "threshold1": 7.541,
          "min_value": 2.088
        }
      ]
    }
  ],
  "max_warnlevel": 4,
  "max_warnlevel_info_de": "Grosse Gefahr",
  "max_warnlevel_info_fr": "Danger fort",
  "n_regions_by_precip_index": {
    "4": 2,
    "2": 1
  },
  "n_regions_by_soil_moisture_index": {
    "5": 3
  },
  "n_regions_by_hydro_index": {
    "5": 3
  },
  "quality": {
    "data_age_days": 1,
    "coverage_pct": 1.0,
    "missing_columns": [],
    "outlier_flags": [],
    "is_stale": false,
    "overall": "ok"
  },
  "n_regions_dry": 3,
  "cdi_min_dry": 5,
  "cdi_max_dry": 5,
  "cdi_situation_delta": -2,
  "mean_precip_sum_1m": 74.0,
  "mean_precip_sum_3m": 171.8,
  "precip_index_min": 2,
  "precip_index_max": 4,
  "n_regions_with_precip_deficit": 3,
  "n_regions_with_soil_moisture_deficit": 3,
  "n_regions_with_vhi_stress": 3,
  "max_vhi_index": 5,
  "discharge": {
    "n_total": 9,
    "n_low": 4,
    "n_very_low": 1,
    "pct_low": 44
  }
}