{
  "canton_id": 15,
  "canton_name_de": "Appenzell Ausserrhoden",
  "canton_name_fr": "Appenzell Rhodes-Extérieures",
  "data_timestamp": "2026-10-23T00:00:00",
  "source": "api",
  "regions": [
    {
      "region_id": 47,
      "region_name_de": "Alpstein",
      "data_timestamp": "2026-10-23T00:00:00",
      "source": "api",
      "cdi": 5,
      "spi_3m": -2.35,
      "soil_moisture_pct": 34.0,
      "vhi": 61.0,
      "cdi_trend": 1,
      "spi_3m_delta": -0.03000000000000025,
      "vhi_delta": 0.0,
      "pct_critical": 0.25,
      "spi_3m_percentile": 1,
      "quality": {
        "data_age_days": 1,
        "coverage_pct": 1.0,
        "missing_columns": [],
        "outlier_flags": [],
        "is_stale": false,
        "overall": "ok"
      },
      "precip_sum_1m": 70.3,
      "precip_sum_3m": 252.1,
      "precip_1m_index": 1,
      "soil_moisture_index": 5,
      "hydro_index": 2,
      "warnlevel": 4,
      "warnlevel_info_de": "Grosse Gefahr",
      "warnlevel_info_fr": "Danger fort",
      "cdi_forecast_week2": 3,
      "precip_1m_index_forecast": 1,
      "soil_moisture_index_forecast": 3,
      "precip_deficit_delta": 0,
      "soil_moisture_deficit_delta": -2,
      "vhi_index": 1,
      "discharge": {
        "n_total": 1,
        "n_low": 0,
        "n_very_low": 0,
        "pct_low": 0
      },
      "hydro_stations": [
        {
          "station_id": "2181",
          "station_name": "Halden (2181)",
          "current_value": 10.05225,
          "low_flow_threshold": 9.963,
          "min_value": 4.182
        }
      ]
    },
    {
      "region_id": 51,
      "region_name_de": "Rheintal",
      "data_timestamp": "2026-10-23T00:00:00",
      "source": "api",
      "cdi": 5,
      "spi_3m": -2.37,
      "soil_moisture_pct": 45.4,
      "vhi": 54.0,
      "cdi_trend": 0,
      "spi_3m_delta": -0.3500000000000001,
      "vhi_delta": 0.0,
      "pct_critical": 0.23076923076923078,
      "spi_3m_percentile": 1,
      "quality": {
        "data_age_days": 1,
        "coverage_pct": 1.0,
        "missing_columns": [],
        "outlier_flags": [],
        "is_stale": false,
        "overall": "ok"
      },
      "precip_sum_1m": 54.1,
      "precip_sum_3m": 235.4,
      "precip_1m_index": 1,
      "soil_moisture_index": 5,
      "hydro_index": 5,
      "warnlevel": 4,
      "warnlevel_info_de": "Grosse Gefahr",
      "warnlevel_info_fr": "Danger fort",
      "cdi_forecast_week2": 4,
      "precip_1m_index_forecast": 1,
      "soil_moisture_index_forecast": 5,
      "precip_deficit_delta": 0,
      "soil_moisture_deficit_delta": 0,
      "vhi_index": 1,
      "discharge": {
        "n_total": 3,
        "n_low": 3,
        "n_very_low": 3,
        "pct_low": 100
      },
      "hydro_stations": [
        {
          "station_id": "2139",
          "station_name": "St. Margrethen (2139)",
          "current_value": 2.53425,
          "low_flow_threshold": 6.331,
          "min_value": 3.639
        },
        {
          "station_id": "2187",
          "station_name": "Salez (2187)",
          "current_value": 2.7365000000000004,
          "low_flow_threshold": 4.544,
          "min_value": 3.18
        },
        {
          "station_id": "2410",
          "station_name": "Ruggell (2410)",
          "current_value": 2.17275,
          "low_flow_threshold": 3.412,
          "min_value": 2.169
        }
      ]
    }
  ],
  "max_warnlevel": 4,
  "max_warnlevel_info_de": "Grosse Gefahr",
  "max_warnlevel_info_fr": "Danger fort",
  "n_regions_by_precip_index": {
    "1": 2
  },
  "n_regions_by_soil_moisture_index": {
    "5": 2
  },
  "n_regions_by_hydro_index": {
    "2": 1,
    "5": 1
  },
  "quality": {
    "data_age_days": 1,
    "coverage_pct": 1.0,
    "missing_columns": [],
    "outlier_flags": [],
    "is_stale": false,
    "overall": "ok"
  },
  "n_regions_dry": 2,
  "cdi_min_dry": 5,
  "cdi_max_dry": 5,
  "cdi_situation_delta": -3,
  "mean_precip_sum_1m": 62.2,
  "mean_precip_sum_3m": 243.8,
  "precip_index_min": 1,
  "precip_index_max": 1,
  "n_regions_with_precip_deficit": 0,
  "n_regions_with_soil_moisture_deficit": 2,
  "n_regions_with_vhi_stress": 0,
  "max_vhi_index": 1,
  "discharge": {
    "n_total": 4,
    "n_low": 3,
    "n_very_low": 3,
    "pct_low": 75
  }
}