{
  "canton_id": 14,
  "canton_name_de": "Schaffhausen",
  "canton_name_fr": "Schaffhouse",
  "data_timestamp": "2026-10-17T00:00:00",
  "source": "api",
  "regions": [
    {
      "region_id": 42,
      "region_name_de": "östliches Mittelland",
      "data_timestamp": "2026-10-17T00:00:00",
      "source": "api",
      "cdi": 4,
      "spi_3m": -1.94,
      "soil_moisture_pct": 39.5,
      "vhi": 48.0,
      "cdi_trend": -1,
      "spi_3m_delta": 0.6200000000000001,
      "vhi_delta": 0.0,
      "pct_critical": 0.15384615384615385,
      "spi_3m_percentile": 2,
      "quality": {
        "data_age_days": 1,
        "coverage_pct": 1.0,
        "missing_columns": [],
        "outlier_flags": [],
        "is_stale": false,
        "overall": "ok"
      },
      "precip_sum_1m": 34.5,
      "precip_sum_3m": 165.8,
      "precip_1m_index": 2,
      "soil_moisture_index": 4,
      "hydro_index": 4,
      "warnlevel": 4,
      "warnlevel_info_de": "Grosse Gefahr",
      "warnlevel_info_fr": "Danger fort",
      "cdi_forecast_week2": 3,
      "precip_1m_index_forecast": 1,
      "soil_moisture_index_forecast": 3,
      "precip_deficit_delta": -1,
      "soil_moisture_deficit_delta": -1,
      "vhi_index": 1,
      "discharge": {
        "n_total": 3,
        "n_low": 3,
        "n_very_low": 3,
        "pct_low": 100
      },
      "hydro_stations": [
        {
          "station_id": "2132",
          "station_name": "Neftenbach (2132)",
          "current_value": 0.9152,
          "low_flow_threshold": 2.351,
          "min_value": 1.217
        },
        {
          "station_id": "2312",
          "station_name": "Salmsach, Hungerbühl (2312)",
          "current_value": 0.0838,
          "low_flow_threshold": 0.164,
          "min_value": 0.09
        },
        {
          "station_id": "2386",
          "station_name": "Frauenfeld (2386)",
          "current_value": 0.592,
          "low_flow_threshold": 1.155,
          "min_value": 0.484
        }
      ]
    }
  ],
  "max_warnlevel": 4,
  "max_warnlevel_info_de": "Grosse Gefahr",
  "max_warnlevel_info_fr": "Danger fort",
  "n_regions_by_precip_index": {
    "2": 1
  },
  "n_regions_by_soil_moisture_index": {
    "4": 1
  },
  "n_regions_by_hydro_index": {
    "4": 1
  },
  "quality": {
    "data_age_days": 1,
    "coverage_pct": 1.0,
    "missing_columns": [],
    "outlier_flags": [],
    "is_stale": false,
    "overall": "ok"
  },
  "n_regions_dry": 1,
  "cdi_min_dry": 4,
  "cdi_max_dry": 4,
  "cdi_situation_delta": -1,
  "mean_precip_sum_1m": 34.5,
  "mean_precip_sum_3m": 165.8,
  "precip_index_min": 2,
  "precip_index_max": 2,
  "n_regions_with_precip_deficit": 1,
  "n_regions_with_soil_moisture_deficit": 1,
  "n_regions_with_vhi_stress": 0,
  "max_vhi_index": 1,
  "discharge": {
    "n_total": 3,
    "n_low": 3,
    "n_very_low": 3,
    "pct_low": 100
  }
}