{
  "canton_id": 22,
  "canton_name_de": "Vaud",
  "canton_name_fr": "Vaud",
  "data_timestamp": "2026-10-30T00:00:00",
  "source": "api",
  "regions": [
    {
      "region_id": 36,
      "region_name_de": "Greyerzerland",
      "data_timestamp": "2026-10-30T00:00:00",
      "source": "api",
      "cdi": 3,
      "spi_3m": -1.0,
      "soil_moisture_pct": 87.5,
      "vhi": 19.0,
      "cdi_trend": -1,
      "spi_3m_delta": 0.75,
      "vhi_delta": 0.0,
      "pct_critical": 0.19230769230769232,
      "spi_3m_percentile": 14,
      "quality": {
        "data_age_days": 1,
        "coverage_pct": 1.0,
        "missing_columns": [],
        "outlier_flags": [],
        "is_stale": false,
        "overall": "ok"
      },
      "precip_sum_1m": 102.9,
      "precip_sum_3m": 267.9,
      "precip_1m_index": 1,
      "soil_moisture_index": 3,
      "hydro_index": 1,
      "warnlevel": 4,
      "warnlevel_info_de": "Grosse Gefahr",
      "warnlevel_info_fr": "Danger fort",
      "cdi_forecast_week2": 3,
      "precip_1m_index_forecast": 1,
      "soil_moisture_index_forecast": 3,
      "precip_deficit_delta": 0,
      "soil_moisture_deficit_delta": 0,
      "vhi_index": 4,
      "discharge": {
        "n_total": 2,
        "n_low": 1,
        "n_very_low": 0,
        "pct_low": 50
      },
      "hydro_stations": [
        {
          "station_id": "2160",
          "station_name": "Broc, Château d'en bas (2160)",
          "current_value": 16.128,
          "low_flow_threshold": 6.874,
          "min_value": 3.744
        },
        {
          "station_id": "2412",
          "station_name": "Vuippens, Château (2412)",
          "current_value": 0.23125,
          "low_flow_threshold": 0.307,
          "min_value": 0.122
        }
      ]
    },
    {
      "region_id": 54,
      "region_name_de": "westlicher Jura",
      "data_timestamp": "2026-10-30T00:00:00",
      "source": "api",
      "cdi": 2,
      "spi_3m": -0.52,
      "soil_moisture_pct": 91.6,
      "vhi": 80.0,
      "cdi_trend": -1,
      "spi_3m_delta": 0.6699999999999999,
      "vhi_delta": 0.0,
      "pct_critical": 0.057692307692307696,
      "spi_3m_percentile": 27,
      "quality": {
        "data_age_days": 1,
        "coverage_pct": 1.0,
        "missing_columns": [],
        "outlier_flags": [],
        "is_stale": false,
        "overall": "ok"
      },
      "precip_sum_1m": 131.6,
      "precip_sum_3m": 271.1,
      "precip_1m_index": 1,
      "soil_moisture_index": 2,
      "hydro_index": 1,
      "warnlevel": 2,
      "warnlevel_info_de": "Mässige Gefahr",
      "warnlevel_info_fr": "Danger limité",
      "cdi_forecast_week2": 2,
      "precip_1m_index_forecast": 1,
      "soil_moisture_index_forecast": 2,
      "precip_deficit_delta": 0,
      "soil_moisture_deficit_delta": 0,
      "vhi_index": 1,
      "discharge": {
        "n_total": 4,
        "n_low": 0,
        "n_very_low": 0,
        "pct_low": 0
      },
      "hydro_stations": [
        {
          "station_id": "2378",
          "station_name": "Orbe, Le Chalet (2378)",
          "current_value": 10.78575,
          "low_flow_threshold": 3.808,
          "min_value": 1.859
        },
        {
          "station_id": "2458",
          "station_name": "Valangin (2458)",
          "current_value": 0.12649999999999997,
          "low_flow_threshold": 0.12,
          "min_value": 0.046
        },
        {
          "station_id": "2480",
          "station_name": "Boudry (2480)",
          "current_value": 9.24625,
          "low_flow_threshold": 2.682,
          "min_value": 0.99
        },
        {
          "station_id": "2493",
          "station_name": "Gland, Route Suisse (2493)",
          "current_value": 2.26675,
          "low_flow_threshold": 0.404,
          "min_value": 0.145
        }
      ]
    },
    {
      "region_id": 55,
      "region_name_de": "westliches Mittelland",
      "data_timestamp": "2026-10-30T00:00:00",
      "source": "api",
      "cdi": 2,
      "spi_3m": -0.76,
      "soil_moisture_pct": 87.7,
      "vhi": 52.0,
      "cdi_trend": -1,
      "spi_3m_delta": 0.5900000000000001,
      "vhi_delta": 0.0,
      "pct_critical": 0.09615384615384616,
      "spi_3m_percentile": 20,
      "quality": {
        "data_age_days": 1,
        "coverage_pct": 1.0,
        "missing_columns": [],
        "outlier_flags": [],
        "is_stale": false,
        "overall": "ok"
      },
      "precip_sum_1m": 88.5,
      "precip_sum_3m": 203.9,
      "precip_1m_index": 1,
      "soil_moisture_index": 2,
      "hydro_index": 1,
      "warnlevel": 2,
      "warnlevel_info_de": "Mässige Gefahr",
      "warnlevel_info_fr": "Danger limité",
      "cdi_forecast_week2": 3,
      "precip_1m_index_forecast": 1,
      "soil_moisture_index_forecast": 2,
      "precip_deficit_delta": 0,
      "soil_moisture_deficit_delta": 0,
      "vhi_index": 1,
      "discharge": {
        "n_total": 2,
        "n_low": 2,
        "n_very_low": 0,
        "pct_low": 100
      },
      "hydro_stations": [
        {
          "station_id": "2034",
          "station_name": "Payerne, Caserne d'aviation (2034)",
          "current_value": 2.148,
          "low_flow_threshold": 2.205,
          "min_value": 0.513
        },
        {
          "station_id": "2369",
          "station_name": "Yvonand, La Mauguettaz (2369)",
          "current_value": 0.30274999999999996,
          "low_flow_threshold": 0.42,
          "min_value": 0.161
        }
      ]
    },
    {
      "region_id": 56,
      "region_name_de": "Genferseebecken",
      "data_timestamp": "2026-10-30T00:00:00",
      "source": "api",
      "cdi": 1,
      "spi_3m": -0.59,
      "soil_moisture_pct": 86.5,
      "vhi": null,
      "cdi_trend": -1,
      "spi_3m_delta": 0.61,
      "vhi_delta": 0.0,
      "pct_critical": 0.057692307692307696,
      "spi_3m_percentile": 26,
      "quality": {
        "data_age_days": 1,
        "coverage_pct": 1.0,
        "missing_columns": [],
        "outlier_flags": [],
        "is_stale": false,
        "overall": "ok"
      },
      "precip_sum_1m": 100.8,
      "precip_sum_3m": 201.6,
      "precip_1m_index": 1,
      "soil_moisture_index": 1,
      "hydro_index": 1,
      "warnlevel": 2,
      "warnlevel_info_de": "Mässige Gefahr",
      "warnlevel_info_fr": "Danger limité",
      "cdi_forecast_week2": 2,
      "precip_1m_index_forecast": 1,
      "soil_moisture_index_forecast": 2,
      "precip_deficit_delta": 0,
      "soil_moisture_deficit_delta": 1,
      "vhi_index": 1,
      "discharge": {
        "n_total": 1,
        "n_low": 0,
        "n_very_low": 0,
        "pct_low": 0
      },
      "hydro_stations": [
        {
          "station_id": "2432",
          "station_name": "Ecublens, Les Bois (2432)",
          "current_value": 3.1185,
          "low_flow_threshold": 0.747,
          "min_value": 0.314
        }
      ]
    },
    {
      "region_id": 57,
      "region_name_de": "Chablais",
      "data_timestamp": "2026-10-30T00:00:00",
      "source": "api",
      "cdi": 2,
      "spi_3m": -0.84,
      "soil_moisture_pct": 95.2,
      "vhi": 21.0,
      "cdi_trend": -1,
      "spi_3m_delta": 0.7300000000000001,
      "vhi_delta": 0.0,
      "pct_critical": 0.1346153846153846,
      "spi_3m_percentile": 19,
      "quality": {
        "data_age_days": 1,
        "coverage_pct": 1.0,
        "missing_columns": [],
        "outlier_flags": [],
        "is_stale": false,
        "overall": "ok"
      },
      "precip_sum_1m": 105.6,
      "precip_sum_3m": 282.8,
      "precip_1m_index": 1,
      "soil_moisture_index": 1,
      "hydro_index": 2,
      "warnlevel": 4,
      "warnlevel_info_de": "Grosse Gefahr",
      "warnlevel_info_fr": "Danger fort",
      "cdi_forecast_week2": 3,
      "precip_1m_index_forecast": 1,
      "soil_moisture_index_forecast": 2,
      "precip_deficit_delta": 0,
      "soil_moisture_deficit_delta": 1,
      "vhi_index": 3,
      "discharge": {
        "n_total": 2,
        "n_low": 0,
        "n_very_low": 0,
        "pct_low": 0
      },
      "hydro_stations": [
        {
          "station_id": "2203",
          "station_name": "Aigle (2203)",
          "current_value": 2.4985,
          "low_flow_threshold": 2.001,
          "min_value": 1.025
        },
        {
          "station_id": "2486",
          "station_name": "Vevey, Copet (2486)",
          "current_value": 0.9657500000000001,
          "low_flow_threshold": 0.498,
          "min_value": 0.139
        }
      ]
    }
  ],
  "max_warnlevel": 4,
  "max_warnlevel_info_de": "Grosse Gefahr",
  "max_warnlevel_info_fr": "Danger fort",
  "n_regions_by_precip_index": {
    "1": 5
  },
  "n_regions_by_soil_moisture_index": {
    "3": 1,
    "2": 2,
    "1": 2
  },
  "n_regions_by_hydro_index": {
    "1": 4,
    "2": 1
  },
  "quality": {
    "data_age_days": 1,
    "coverage_pct": 1.0,
    "missing_columns": [],
    "outlier_flags": [],
    "is_stale": false,
    "overall": "ok"
  },
  "n_regions_dry": 4,
  "cdi_min_dry": 2,
  "cdi_max_dry": 3,
  "cdi_situation_delta": 3,
  "mean_precip_sum_1m": 105.9,
  "mean_precip_sum_3m": 245.5,
  "precip_index_min": 1,
  "precip_index_max": 1,
  "n_regions_with_precip_deficit": 0,
  "n_regions_with_soil_moisture_deficit": 3,
  "n_regions_with_vhi_stress": 2,
  "max_vhi_index": 4,
  "discharge": {
    "n_total": 11,
    "n_low": 3,
    "n_very_low": 0,
    "pct_low": 27
  }
}