{
  "canton_id": 4,
  "canton_name_de": "Uri",
  "canton_name_fr": "Uri",
  "data_timestamp": "2026-10-19T00:00:00",
  "source": "api",
  "regions": [
    {
      "region_id": 44,
      "region_name_de": "östliche Zentralschweiz",
      "data_timestamp": "2026-10-19T00:00:00",
      "source": "api",
      "cdi": 4,
      "spi_3m": -2.46,
      "soil_moisture_pct": 93.4,
      "vhi": 62.0,
      "cdi_trend": 0,
      "spi_3m_delta": -0.3700000000000001,
      "vhi_delta": 0.0,
      "pct_critical": 0.09615384615384616,
      "spi_3m_percentile": 1,
      "quality": {
        "data_age_days": 0,
        "coverage_pct": 1.0,
        "missing_columns": [],
        "outlier_flags": [],
        "is_stale": false,
        "overall": "ok"
      },
      "precip_sum_1m": 62.7,
      "precip_sum_3m": 275.2,
      "precip_1m_index": 2,
      "soil_moisture_index": 3,
      "hydro_index": 3,
      "warnlevel": 4,
      "warnlevel_info_de": "Grosse Gefahr",
      "warnlevel_info_fr": "Danger fort",
      "cdi_forecast_week2": 3,
      "precip_1m_index_forecast": 1,
      "soil_moisture_index_forecast": 2,
      "precip_deficit_delta": -1,
      "soil_moisture_deficit_delta": -1,
      "vhi_index": 1,
      "discharge": {
        "n_total": 4,
        "n_low": 4,
        "n_very_low": 1,
        "pct_low": 100
      },
      "hydro_stations": [
        {
          "station_id": "2084",
          "station_name": "Ingenbohl (2084)",
          "current_value": 4.820142857142857,
          "low_flow_threshold": 7.397,
          "min_value": 2.936
        },
        {
          "station_id": "2300",
          "station_name": "Euthal, Rüti (2300)",
          "current_value": 0.5585714285714286,
          "low_flow_threshold": 0.64,
          "min_value": 0.07
        },
        {
          "station_id": "2604",
          "station_name": "Biberbrugg (2604)",
          "current_value": 0.1564285714285714,
          "low_flow_threshold": 0.241,
          "min_value": 0.074
        },
        {
          "station_id": "2609",
          "station_name": "Einsiedeln (2609)",
          "current_value": 0.2834285714285714,
          "low_flow_threshold": 0.535,
          "min_value": 0.251
        }
      ]
    },
    {
      "region_id": 45,
      "region_name_de": "Urner Alpen",
      "data_timestamp": "2026-10-19T00:00:00",
      "source": "api",
      "cdi": 5,
      "spi_3m": -2.62,
      "soil_moisture_pct": 90.3,
      "vhi": 54.0,
      "cdi_trend": 1,
      "spi_3m_delta": -0.6600000000000001,
      "vhi_delta": 0.0,
      "pct_critical": 0.11538461538461539,
      "spi_3m_percentile": 0,
      "quality": {
        "data_age_days": 0,
        "coverage_pct": 1.0,
        "missing_columns": [],
        "outlier_flags": [],
        "is_stale": false,
        "overall": "ok"
      },
      "precip_sum_1m": 27.3,
      "precip_sum_3m": 212.4,
      "precip_1m_index": 4,
      "soil_moisture_index": 3,
      "hydro_index": 5,
      "warnlevel": 4,
      "warnlevel_info_de": "Grosse Gefahr",
      "warnlevel_info_fr": "Danger fort",
      "cdi_forecast_week2": 4,
      "precip_1m_index_forecast": 1,
      "soil_moisture_index_forecast": 2,
      "precip_deficit_delta": -3,
      "soil_moisture_deficit_delta": -1,
      "vhi_index": 1,
      "discharge": {
        "n_total": 2,
        "n_low": 2,
        "n_very_low": 0,
        "pct_low": 100
      },
      "hydro_stations": [
        {
          "station_id": "2056",
          "station_name": "Seedorf (2056)",
          "current_value": 16.44542857142857,
          "low_flow_threshold": 24.309,
          "min_value": 15.06
        },
        {
          "station_id": "2276",
          "station_name": "Isenthal (2276)",
          "current_value": 0.4614285714285713,
          "low_flow_threshold": 0.797,
          "min_value": 0.475
        }
      ]
    },
    {
      "region_id": 48,
      "region_name_de": "Glarner Alpen",
      "data_timestamp": "2026-10-19T00:00:00",
      "source": "api",
      "cdi": 5,
      "spi_3m": -2.64,
      "soil_moisture_pct": 89.9,
      "vhi": 62.0,
      "cdi_trend": 0,
      "spi_3m_delta": -0.6400000000000001,
      "vhi_delta": 0.0,
      "pct_critical": 0.11538461538461539,
      "spi_3m_percentile": 0,
      "quality": {
        "data_age_days": 0,
        "coverage_pct": 1.0,
        "missing_columns": [],
        "outlier_flags": [],
        "is_stale": false,
        "overall": "ok"
      },
      "precip_sum_1m": 48.8,
      "precip_sum_3m": 240.1,
      "precip_1m_index": 2,
      "soil_moisture_index": 3,
      "hydro_index": 5,
      "warnlevel": 4,
      "warnlevel_info_de": "Grosse Gefahr",
      "warnlevel_info_fr": "Danger fort",
      "cdi_forecast_week2": 4,
      "precip_1m_index_forecast": 1,
      "soil_moisture_index_forecast": 3,
      "precip_deficit_delta": -1,
      "soil_moisture_deficit_delta": 0,
      "vhi_index": 1,
      "discharge": {
        "n_total": 1,
        "n_low": 1,
        "n_very_low": 1,
        "pct_low": 100
      },
      "hydro_stations": [
        {
          "station_id": "2104",
          "station_name": "Weesen, Biäsche (2104)",
          "current_value": 15.459142857142856,
          "low_flow_threshold": 31.22,
          "min_value": 19.771
        }
      ]
    }
  ],
  "max_warnlevel": 4,
  "max_warnlevel_info_de": "Grosse Gefahr",
  "max_warnlevel_info_fr": "Danger fort",
  "n_regions_by_precip_index": {
    "2": 2,
    "4": 1
  },
  "n_regions_by_soil_moisture_index": {
    "3": 3
  },
  "n_regions_by_hydro_index": {
    "3": 1,
    "5": 2
  },
  "quality": {
    "data_age_days": 0,
    "coverage_pct": 1.0,
    "missing_columns": [],
    "outlier_flags": [],
    "is_stale": false,
    "overall": "ok"
  },
  "n_regions_dry": 3,
  "cdi_min_dry": 4,
  "cdi_max_dry": 5,
  "cdi_situation_delta": -3,
  "mean_precip_sum_1m": 46.3,
  "mean_precip_sum_3m": 242.6,
  "precip_index_min": 2,
  "precip_index_max": 4,
  "n_regions_with_precip_deficit": 3,
  "n_regions_with_soil_moisture_deficit": 3,
  "n_regions_with_vhi_stress": 0,
  "max_vhi_index": 1,
  "discharge": {
    "n_total": 7,
    "n_low": 7,
    "n_very_low": 2,
    "pct_low": 100
  }
}