{
  "canton_id": 12,
  "canton_name_de": "Basel-Stadt",
  "canton_name_fr": "Bâle-Ville",
  "data_timestamp": "2026-07-15T00:00:00",
  "source": "api",
  "regions": [
    {
      "region_id": 31,
      "region_name_de": "östlicher Jura",
      "data_timestamp": "2026-07-15T00:00:00",
      "source": "api",
      "cdi": 5,
      "spi_3m": -2.96,
      "soil_moisture_pct": 6.1,
      "vhi": 22.0,
      "cdi_trend": 0,
      "spi_3m_delta": -0.5499999999999998,
      "vhi_delta": 0.0,
      "pct_critical": 0.038461538461538464,
      "spi_3m_percentile": 0,
      "quality": {
        "data_age_days": 1,
        "coverage_pct": 1.0,
        "missing_columns": [],
        "outlier_flags": [],
        "is_stale": false,
        "overall": "ok"
      },
      "precip_sum_1m": 21.3,
      "precip_sum_3m": 134.1,
      "precip_1m_index": 5,
      "soil_moisture_index": 5,
      "hydro_index": 5,
      "warnlevel": 4,
      "warnlevel_info_de": "Grosse Gefahr",
      "warnlevel_info_fr": "Danger fort",
      "cdi_forecast_week2": 4,
      "precip_1m_index_forecast": 1,
      "soil_moisture_index_forecast": 1,
      "precip_deficit_delta": -4,
      "soil_moisture_deficit_delta": -4,
      "vhi_index": 3,
      "discharge": {
        "n_total": 3,
        "n_low": 3,
        "n_very_low": 3,
        "pct_low": 100
      },
      "hydro_stations": [
        {
          "station_id": "2106",
          "station_name": "Münchenstein, Hofmatt (2106)",
          "current_value": 1.754,
          "threshold1": 4.89,
          "min_value": 2.594
        },
        {
          "station_id": "2202",
          "station_name": "Liestal (2202)",
          "current_value": 0.1105,
          "threshold1": 0.694,
          "min_value": 0.27
        },
        {
          "station_id": "2485",
          "station_name": "Boncourt, Frontière (2485)",
          "current_value": 0.309,
          "threshold1": 0.587,
          "min_value": 0.248
        }
      ]
    }
  ],
  "max_warnlevel": 4,
  "max_warnlevel_info_de": "Grosse Gefahr",
  "max_warnlevel_info_fr": "Danger fort",
  "n_regions_by_precip_index": {
    "5": 1
  },
  "n_regions_by_soil_moisture_index": {
    "5": 1
  },
  "n_regions_by_hydro_index": {
    "5": 1
  },
  "quality": {
    "data_age_days": 1,
    "coverage_pct": 1.0,
    "missing_columns": [],
    "outlier_flags": [],
    "is_stale": false,
    "overall": "ok"
  },
  "n_regions_dry": 1,
  "cdi_min_dry": 5,
  "cdi_max_dry": 5,
  "cdi_situation_delta": -1,
  "mean_precip_sum_1m": 21.3,
  "mean_precip_sum_3m": 134.1,
  "precip_index_min": 5,
  "precip_index_max": 5,
  "n_regions_with_precip_deficit": 1,
  "n_regions_with_soil_moisture_deficit": 1,
  "n_regions_with_vhi_stress": 1,
  "max_vhi_index": 3,
  "discharge": {
    "n_total": 3,
    "n_low": 3,
    "n_very_low": 3,
    "pct_low": 100
  }
}