{
  "canton_id": 11,
  "canton_name_de": "Solothurn",
  "canton_name_fr": "Soleure",
  "data_timestamp": "2026-10-27T00:00:00",
  "source": "api",
  "regions": [
    {
      "region_id": 31,
      "region_name_de": "östlicher Jura",
      "data_timestamp": "2026-10-27T00:00:00",
      "source": "api",
      "cdi": 2,
      "spi_3m": -0.91,
      "soil_moisture_pct": 78.5,
      "vhi": 67.0,
      "cdi_trend": -1,
      "spi_3m_delta": 0.5499999999999999,
      "vhi_delta": 0.0,
      "pct_critical": 0.038461538461538464,
      "spi_3m_percentile": 17,
      "quality": {
        "data_age_days": 0,
        "coverage_pct": 0.9,
        "missing_columns": [
          "vhi"
        ],
        "outlier_flags": [],
        "is_stale": false,
        "overall": "warning"
      },
      "precip_sum_1m": 99.7,
      "precip_sum_3m": 201.5,
      "precip_1m_index": 1,
      "soil_moisture_index": 2,
      "hydro_index": 1,
      "warnlevel": 2,
      "warnlevel_info_de": "Mässige Gefahr",
      "warnlevel_info_fr": "Danger limité",
      "cdi_forecast_week2": 3,
      "precip_1m_index_forecast": 1,
      "soil_moisture_index_forecast": 3,
      "precip_deficit_delta": 0,
      "soil_moisture_deficit_delta": 1,
      "vhi_index": 1,
      "discharge": {
        "n_total": 3,
        "n_low": 0,
        "n_very_low": 0,
        "pct_low": 0
      },
      "hydro_stations": [
        {
          "station_id": "2106",
          "station_name": "Münchenstein, Hofmatt (2106)",
          "current_value": 14.971,
          "low_flow_threshold": 4.37,
          "min_value": 1.741
        },
        {
          "station_id": "2202",
          "station_name": "Liestal (2202)",
          "current_value": 1.224,
          "low_flow_threshold": 0.623,
          "min_value": 0.188
        },
        {
          "station_id": "2485",
          "station_name": "Boncourt, Frontière (2485)",
          "current_value": 0.767,
          "low_flow_threshold": 0.658,
          "min_value": 0.281
        }
      ]
    },
    {
      "region_id": 32,
      "region_name_de": "Balsthal",
      "data_timestamp": "2026-10-27T00:00:00",
      "source": "api",
      "cdi": 2,
      "spi_3m": -0.56,
      "soil_moisture_pct": 88.2,
      "vhi": 64.0,
      "cdi_trend": -1,
      "spi_3m_delta": 0.6699999999999999,
      "vhi_delta": 0.0,
      "pct_critical": 0.057692307692307696,
      "spi_3m_percentile": 27,
      "quality": {
        "data_age_days": 0,
        "coverage_pct": 0.9,
        "missing_columns": [
          "vhi"
        ],
        "outlier_flags": [],
        "is_stale": false,
        "overall": "warning"
      },
      "precip_sum_1m": 111.7,
      "precip_sum_3m": 249.5,
      "precip_1m_index": 1,
      "soil_moisture_index": 2,
      "hydro_index": 1,
      "warnlevel": 2,
      "warnlevel_info_de": "Mässige Gefahr",
      "warnlevel_info_fr": "Danger limité",
      "cdi_forecast_week2": 3,
      "precip_1m_index_forecast": 1,
      "soil_moisture_index_forecast": 3,
      "precip_deficit_delta": 0,
      "soil_moisture_deficit_delta": 1,
      "vhi_index": 1,
      "discharge": {
        "n_total": 2,
        "n_low": 0,
        "n_very_low": 0,
        "pct_low": 0
      },
      "hydro_stations": [
        {
          "station_id": "2307",
          "station_name": "Sonceboz (2307)",
          "current_value": 7.503,
          "low_flow_threshold": 1.22,
          "min_value": 0.402
        },
        {
          "station_id": "2434",
          "station_name": "Olten, Hammermühle (2434)",
          "current_value": 2.358,
          "low_flow_threshold": 0.647,
          "min_value": 0.233
        }
      ]
    },
    {
      "region_id": 33,
      "region_name_de": "Unteres Emmental",
      "data_timestamp": "2026-10-27T00:00:00",
      "source": "api",
      "cdi": 3,
      "spi_3m": -1.02,
      "soil_moisture_pct": 82.3,
      "vhi": 62.0,
      "cdi_trend": -1,
      "spi_3m_delta": 0.6299999999999999,
      "vhi_delta": 0.0,
      "pct_critical": 0.07692307692307693,
      "spi_3m_percentile": 13,
      "quality": {
        "data_age_days": 0,
        "coverage_pct": 1.0,
        "missing_columns": [],
        "outlier_flags": [],
        "is_stale": false,
        "overall": "ok"
      },
      "precip_sum_1m": 76.2,
      "precip_sum_3m": 204.9,
      "precip_1m_index": 1,
      "soil_moisture_index": 3,
      "hydro_index": 1,
      "warnlevel": 4,
      "warnlevel_info_de": "Grosse Gefahr",
      "warnlevel_info_fr": "Danger fort",
      "cdi_forecast_week2": 4,
      "precip_1m_index_forecast": 1,
      "soil_moisture_index_forecast": 4,
      "precip_deficit_delta": 0,
      "soil_moisture_deficit_delta": 1,
      "vhi_index": 1,
      "discharge": {
        "n_total": 1,
        "n_low": 1,
        "n_very_low": 0,
        "pct_low": 100
      },
      "hydro_stations": [
        {
          "station_id": "2500",
          "station_name": "Ittigen (2500)",
          "current_value": 0.501,
          "low_flow_threshold": 0.516,
          "min_value": 0.355
        }
      ]
    },
    {
      "region_id": 37,
      "region_name_de": "Oberaargau",
      "data_timestamp": "2026-10-27T00:00:00",
      "source": "api",
      "cdi": 4,
      "spi_3m": -1.37,
      "soil_moisture_pct": 74.4,
      "vhi": 59.0,
      "cdi_trend": 0,
      "spi_3m_delta": 0.6499999999999999,
      "vhi_delta": 0.0,
      "pct_critical": 0.057692307692307696,
      "spi_3m_percentile": 7,
      "quality": {
        "data_age_days": 0,
        "coverage_pct": 1.0,
        "missing_columns": [],
        "outlier_flags": [],
        "is_stale": false,
        "overall": "ok"
      },
      "precip_sum_1m": 72.5,
      "precip_sum_3m": 187.9,
      "precip_1m_index": 1,
      "soil_moisture_index": 4,
      "hydro_index": 1,
      "warnlevel": 4,
      "warnlevel_info_de": "Grosse Gefahr",
      "warnlevel_info_fr": "Danger fort",
      "cdi_forecast_week2": 4,
      "precip_1m_index_forecast": 1,
      "soil_moisture_index_forecast": 5,
      "precip_deficit_delta": 0,
      "soil_moisture_deficit_delta": 1,
      "vhi_index": 1,
      "discharge": {
        "n_total": 2,
        "n_low": 2,
        "n_very_low": 2,
        "pct_low": 100
      },
      "hydro_stations": [
        {
          "station_id": "2450",
          "station_name": "Zofingen (2450)",
          "current_value": 1.421,
          "low_flow_threshold": 2.51,
          "min_value": 1.267
        },
        {
          "station_id": "2471",
          "station_name": "Murgenthal, Walliswil (2471)",
          "current_value": 1.389,
          "low_flow_threshold": 1.887,
          "min_value": 1.141
        }
      ]
    }
  ],
  "max_warnlevel": 4,
  "max_warnlevel_info_de": "Grosse Gefahr",
  "max_warnlevel_info_fr": "Danger fort",
  "n_regions_by_precip_index": {
    "1": 4
  },
  "n_regions_by_soil_moisture_index": {
    "2": 2,
    "3": 1,
    "4": 1
  },
  "n_regions_by_hydro_index": {
    "1": 4
  },
  "quality": {
    "data_age_days": 0,
    "coverage_pct": 0.95,
    "missing_columns": [
      "vhi"
    ],
    "outlier_flags": [],
    "is_stale": false,
    "overall": "warning"
  },
  "n_regions_dry": 4,
  "cdi_min_dry": 2,
  "cdi_max_dry": 4,
  "cdi_situation_delta": 3,
  "mean_precip_sum_1m": 90.0,
  "mean_precip_sum_3m": 210.9,
  "precip_index_min": 1,
  "precip_index_max": 1,
  "n_regions_with_precip_deficit": 0,
  "n_regions_with_soil_moisture_deficit": 4,
  "n_regions_with_vhi_stress": 0,
  "max_vhi_index": 1,
  "discharge": {
    "n_total": 8,
    "n_low": 3,
    "n_very_low": 2,
    "pct_low": 38
  }
}