{
  "canton_id": 21,
  "canton_name_de": "Ticino",
  "canton_name_fr": "Tessin",
  "data_timestamp": "2026-10-11T00:00:00",
  "source": "api",
  "regions": [
    {
      "region_id": 62,
      "region_name_de": "Westliches Tessin",
      "data_timestamp": "2026-10-11T00:00:00",
      "source": "api",
      "cdi": 5,
      "spi_3m": -1.25,
      "soil_moisture_pct": 48.4,
      "vhi": 43.0,
      "cdi_trend": 1,
      "spi_3m_delta": -0.030000000000000027,
      "vhi_delta": 0.0,
      "pct_critical": 0.019230769230769232,
      "spi_3m_percentile": 9,
      "quality": {
        "data_age_days": 1,
        "coverage_pct": 1.0,
        "missing_columns": [],
        "outlier_flags": [],
        "is_stale": false,
        "overall": "ok"
      },
      "precip_sum_1m": 45.8,
      "precip_sum_3m": 290.3,
      "precip_1m_index": 2,
      "soil_moisture_index": 5,
      "hydro_index": 5,
      "warnlevel": 1,
      "warnlevel_info_de": "Keine oder geringe Gefahr",
      "warnlevel_info_fr": "Aucun ou faible danger",
      "cdi_forecast_week2": 2,
      "precip_1m_index_forecast": 1,
      "soil_moisture_index_forecast": 1,
      "precip_deficit_delta": -1,
      "soil_moisture_deficit_delta": -4,
      "vhi_index": 1,
      "discharge": {
        "n_total": 2,
        "n_low": 1,
        "n_very_low": 0,
        "pct_low": 50
      },
      "hydro_stations": [
        {
          "station_id": "2244",
          "station_name": "Klusmatten (2244)",
          "current_value": 0.2065,
          "low_flow_threshold": 0.264,
          "min_value": 0.179
        },
        {
          "station_id": "2605",
          "station_name": "Lavertezzo, Campiòi (2605)",
          "current_value": 5.222833333333333,
          "low_flow_threshold": 3.011,
          "min_value": 1.604
        }
      ]
    },
    {
      "region_id": 63,
      "region_name_de": "Nordtessin",
      "data_timestamp": "2026-10-11T00:00:00",
      "source": "api",
      "cdi": 5,
      "spi_3m": -1.25,
      "soil_moisture_pct": 53.4,
      "vhi": 39.0,
      "cdi_trend": 1,
      "spi_3m_delta": -0.020000000000000018,
      "vhi_delta": 0.0,
      "pct_critical": 0.019230769230769232,
      "spi_3m_percentile": 11,
      "quality": {
        "data_age_days": 1,
        "coverage_pct": 1.0,
        "missing_columns": [],
        "outlier_flags": [],
        "is_stale": false,
        "overall": "ok"
      },
      "precip_sum_1m": 41.7,
      "precip_sum_3m": 289.2,
      "precip_1m_index": 2,
      "soil_moisture_index": 5,
      "hydro_index": 5,
      "warnlevel": 1,
      "warnlevel_info_de": "Keine oder geringe Gefahr",
      "warnlevel_info_fr": "Aucun ou faible danger",
      "cdi_forecast_week2": 4,
      "precip_1m_index_forecast": 1,
      "soil_moisture_index_forecast": 1,
      "precip_deficit_delta": -1,
      "soil_moisture_deficit_delta": -4,
      "vhi_index": 2,
      "discharge": {
        "n_total": 1,
        "n_low": 1,
        "n_very_low": 1,
        "pct_low": 100
      },
      "hydro_stations": [
        {
          "station_id": "2494",
          "station_name": "Pollegio, Campagna (2494)",
          "current_value": 7.848166666666667,
          "low_flow_threshold": 9.958,
          "min_value": 6.453
        }
      ]
    },
    {
      "region_id": 64,
      "region_name_de": "Östliches Tessin",
      "data_timestamp": "2026-10-11T00:00:00",
      "source": "api",
      "cdi": 2,
      "spi_3m": -0.93,
      "soil_moisture_pct": 52.6,
      "vhi": 44.0,
      "cdi_trend": 0,
      "spi_3m_delta": -0.020000000000000018,
      "vhi_delta": 0.0,
      "pct_critical": 0.0,
      "spi_3m_percentile": 17,
      "quality": {
        "data_age_days": 1,
        "coverage_pct": 1.0,
        "missing_columns": [],
        "outlier_flags": [],
        "is_stale": false,
        "overall": "ok"
      },
      "precip_sum_1m": 59.9,
      "precip_sum_3m": 356.1,
      "precip_1m_index": 1,
      "soil_moisture_index": 4,
      "hydro_index": 2,
      "warnlevel": 1,
      "warnlevel_info_de": "Keine oder geringe Gefahr",
      "warnlevel_info_fr": "Aucun ou faible danger",
      "cdi_forecast_week2": 2,
      "precip_1m_index_forecast": 1,
      "soil_moisture_index_forecast": 1,
      "precip_deficit_delta": 0,
      "soil_moisture_deficit_delta": -3,
      "vhi_index": 1,
      "discharge": {
        "n_total": 1,
        "n_low": 0,
        "n_very_low": 0,
        "pct_low": 0
      },
      "hydro_stations": [
        {
          "station_id": "2420",
          "station_name": "Lumino, Sassello (2420)",
          "current_value": 9.710166666666668,
          "low_flow_threshold": 8.854,
          "min_value": 4.944
        }
      ]
    },
    {
      "region_id": 65,
      "region_name_de": "Sottoceneri",
      "data_timestamp": "2026-10-11T00:00:00",
      "source": "api",
      "cdi": 3,
      "spi_3m": -0.86,
      "soil_moisture_pct": 61.9,
      "vhi": 48.0,
      "cdi_trend": 1,
      "spi_3m_delta": -0.010000000000000009,
      "vhi_delta": 0.0,
      "pct_critical": 0.0,
      "spi_3m_percentile": 19,
      "quality": {
        "data_age_days": 1,
        "coverage_pct": 1.0,
        "missing_columns": [],
        "outlier_flags": [],
        "is_stale": false,
        "overall": "ok"
      },
      "precip_sum_1m": 63.7,
      "precip_sum_3m": 361.4,
      "precip_1m_index": 2,
      "soil_moisture_index": 3,
      "hydro_index": 3,
      "warnlevel": 1,
      "warnlevel_info_de": "Keine oder geringe Gefahr",
      "warnlevel_info_fr": "Aucun ou faible danger",
      "cdi_forecast_week2": 1,
      "precip_1m_index_forecast": 1,
      "soil_moisture_index_forecast": 1,
      "precip_deficit_delta": -1,
      "soil_moisture_deficit_delta": -2,
      "vhi_index": 1,
      "discharge": {
        "n_total": 3,
        "n_low": 1,
        "n_very_low": 0,
        "pct_low": 33
      },
      "hydro_stations": [
        {
          "station_id": "2321",
          "station_name": "Pregassona (2321)",
          "current_value": 1.084,
          "low_flow_threshold": 0.761,
          "min_value": 0.355
        },
        {
          "station_id": "2349",
          "station_name": "Chiasso, Ponte di Polenta (2349)",
          "current_value": 0.045,
          "low_flow_threshold": 0.072,
          "min_value": 0.017
        },
        {
          "station_id": "2461",
          "station_name": "Magliaso, Ponte (2461)",
          "current_value": 0.3354999999999999,
          "low_flow_threshold": 0.26,
          "min_value": 0.098
        }
      ]
    }
  ],
  "max_warnlevel": 1,
  "max_warnlevel_info_de": "Keine oder geringe Gefahr",
  "max_warnlevel_info_fr": "Aucun ou faible danger",
  "n_regions_by_precip_index": {
    "2": 3,
    "1": 1
  },
  "n_regions_by_soil_moisture_index": {
    "5": 2,
    "4": 1,
    "3": 1
  },
  "n_regions_by_hydro_index": {
    "5": 2,
    "2": 1,
    "3": 1
  },
  "quality": {
    "data_age_days": 1,
    "coverage_pct": 1.0,
    "missing_columns": [],
    "outlier_flags": [],
    "is_stale": false,
    "overall": "ok"
  },
  "n_regions_dry": 4,
  "cdi_min_dry": 2,
  "cdi_max_dry": 5,
  "cdi_situation_delta": -6,
  "mean_precip_sum_1m": 52.8,
  "mean_precip_sum_3m": 324.2,
  "precip_index_min": 1,
  "precip_index_max": 2,
  "n_regions_with_precip_deficit": 3,
  "n_regions_with_soil_moisture_deficit": 4,
  "n_regions_with_vhi_stress": 1,
  "max_vhi_index": 2,
  "discharge": {
    "n_total": 7,
    "n_low": 3,
    "n_very_low": 1,
    "pct_low": 43
  }
}